{"run":18,"commit":"63647ae","metric":1794,"metrics":{"system_prompt_tokens_max":1794,"system_prompt_chars_max":8672,"constraint_preserving_retry_e2e_score":0.696,"pass_rate":0.4,"quality_avg":6,"avg_extra_tool_calls":0.4,"runner_failures":0,"anti_hardcoding_violations":0,"effectiveness_penalty":0},"status":"discard","description":"Rerun the current champion unchanged to estimate live benchmark variance before more prompt edits.","timestamp":1777668251882,"segment":0,"confidence":1.8835299669655499,"asi":{"hypothesis":"After several tiny prompt edits caused large live e2e collapses, rerunning the unchanged champion should estimate benchmark variance and confirm whether the current best still clears the effectiveness floor.","learned":"The unchanged champion stayed at the same primary metric (1794 tokens, zero penalty) and cleared the floor with e2e 0.696, but this is much lower than the prior 0.946 champion run. The metric is live-model noisy; require extra caution before accepting tiny behavior-adjacent prompt edits. Token-only improvements should be preferred only when e2e remains above floor, and borderline candidates deserve confirmation.","rollback_reason":"No product change was tested and the primary metric did not improve below the current best of 1794.","next_action_hint":"Continue with larger structural token reductions that are semantically low-risk, but consider confirming promising keeps when e2e is close to the 0.65 floor. Avoid tiny base wording edits where token savings are small and variance can dominate."}}
{"run":19,"commit":"63647ae","metric":13725,"metrics":{"system_prompt_tokens_max":1725,"system_prompt_chars_max":8473,"constraint_preserving_retry_e2e_score":0.41,"pass_rate":0.2,"quality_avg":4.4,"avg_extra_tool_calls":1,"runner_failures":0,"anti_hardcoding_violations":0,"effectiveness_penalty":12000},"status":"discard","description":"Remove the base DotAgents config common-file examples bullet.","timestamp":1777668412752,"segment":0,"confidence":1.0352770284291346,"asi":{"hypothesis":"The long examples bullet listing common DotAgents config filenames is not needed for the constraint-retry behavior because the prompt still explains layered config and tells the agent to load dotagents-config-admin for exact edit recipes.","learned":"Removing the examples bullet saved 69 tokens, but e2e fell to 0.410 and introduced a large floor penalty. The explicit config file examples may help the model reason about skill/config locations, or live variance remains high; either way this base config deletion is not safe to keep.","rollback_reason":"Primary metric worsened from current best 1794 to 13725 because effectiveness dropped below the 0.65 floor despite lower prompt tokens.","next_action_hint":"Avoid deleting base DotAgents config details in this session. Future token savings should avoid base memory/config/tool policy sections, or require repeated confirmation if attempted."}}
{"run":20,"commit":"3ef7c63","metric":1792,"metrics":{"system_prompt_tokens_max":1792,"system_prompt_chars_max":8669,"constraint_preserving_retry_e2e_score":0.698,"pass_rate":0.4,"quality_avg":6,"avg_extra_tool_calls":0.2,"runner_failures":0,"anti_hardcoding_violations":0,"effectiveness_penalty":0},"status":"keep","description":"Drop seconds from the injected compact current-time prompt line.","timestamp":1777668594998,"segment":0,"confidence":1.8828412413923215,"asi":{"hypothesis":"Relative-date reasoning usually needs date, hour/minute, and timezone but not seconds, so the compact current-time line can omit seconds for a tiny prompt-token reduction without behavior loss.","learned":"Removing seconds saved 2 prompt tokens and 3 chars while e2e stayed above the floor at 0.698 with lower extra tool calls. This is a small low-risk formatting win; effectiveness remains noisy but safely above the floor on this run.","next_action_hint":"Continue only with low-risk formatting/prompt-list changes or larger structural changes with preserved cues. Avoid base TOOL USAGE, TONE, STATUS, and local-memory/config wording edits that previously collapsed e2e."}}
{"run":21,"commit":"3ef7c63","metric":11587,"metrics":{"system_prompt_tokens_max":1787,"system_prompt_chars_max":8655,"constraint_preserving_retry_e2e_score":0.454,"pass_rate":0.2,"quality_avg":5.2,"avg_extra_tool_calls":0.6,"runner_failures":0,"anti_hardcoding_violations":0,"effectiveness_penalty":9800},"status":"discard","description":"Compress the inline runtime tools header and separators.","timestamp":1777668743555,"segment":0,"confidence":1.0557494975140167,"asi":{"hypothesis":"The compact inline runtime tool list should keep exact tool names visible even if the header is shortened from DOTAGENTS TOOLS to TOOLS and comma separators are removed, saving a few prompt tokens without changing available-tool semantics.","learned":"The edit saved 5 tokens, but e2e dropped to 0.454 and triggered a large effectiveness penalty. The exact 'DOTAGENTS TOOLS' header and comma-separated formatting may be a useful availability cue, or the run reflects live variance; the small token win is not worth the risk.","rollback_reason":"Primary metric worsened from current best 1792 to 11587 because effectiveness fell below the 0.65 floor.","next_action_hint":"Keep the runtime tool list in the proven 'DOTAGENTS TOOLS: name, name' format. Avoid further tool-availability cue formatting edits unless validated by repeated runs."}}
