{"type":"config","name":"Reduce DotAgents system prompt tokens while preserving constraint-retry effectiveness","metricName":"prompt_token_penalty_score","metricUnit":"","bestDirection":"lower"}
{"run":1,"commit":"6afc859","metric":11772,"metrics":{"system_prompt_tokens_max":2472,"system_prompt_chars_max":11900,"constraint_preserving_retry_e2e_score":0.464,"pass_rate":0.2,"quality_avg":5.4,"avg_extra_tool_calls":0.6,"runner_failures":0,"anti_hardcoding_violations":0,"effectiveness_penalty":9300},"status":"keep","description":"Baseline prompt-token benchmark initialized from merged constraint-preserving prompt.","timestamp":1777665502714,"segment":0,"confidence":null,"asi":{"hypothesis":"Establish the new objective and baseline: measure the actual assembled system prompt tokens while preserving the existing constraint-preserving retry replay behavior.","learned":"Baseline assembled system prompt is about 2472 regex tokens / 11900 chars. Live effectiveness was 0.464 on this noisy single run, below the 0.65 floor, so the primary metric includes a 9300 effectiveness penalty. Future candidates need reduce tokens without worsening this e2e score and ideally recover above the floor."}}
{"run":2,"commit":"6afc859","metric":14600,"metrics":{"system_prompt_tokens_max":2200,"system_prompt_chars_max":10636,"constraint_preserving_retry_e2e_score":0.402,"pass_rate":0.2,"quality_avg":4.2,"avg_extra_tool_calls":0.8,"runner_failures":0,"anti_hardcoding_violations":0,"effectiveness_penalty":12400},"status":"discard","description":"Compact base prompt local memory and DotAgents config sections into one shorter section.","timestamp":1777665680117,"segment":0,"confidence":null,"asi":{"hypothesis":"The duplicated base prompt sections for knowledge notes, past conversations, and DotAgents config can be compressed into a single local-memory/config section because agent-mode already injects similar guidance later.","learned":"Tokens dropped from 2472 to 2200 (-272, about 11%), but live effectiveness fell from 0.464 to 0.402, increasing the floor penalty enough to worsen the primary metric. This broad base-section compression may remove useful retrieval/config detail or simply be within live-model noise, but it is not safe to keep as-is.","rollback_reason":"Primary metric worsened from 11772 to 14600 because the effectiveness penalty increased despite lower prompt tokens.","next_action_hint":"Try smaller, lower-risk compression in duplicated agent-mode sections or sections less tied to replay behavior, and preserve concrete past-conversation/config retrieval details until a candidate beats the baseline."}}
{"run":3,"commit":"61f6fef","metric":2417,"metrics":{"system_prompt_tokens_max":2417,"system_prompt_chars_max":11594,"constraint_preserving_retry_e2e_score":0.694,"pass_rate":0.4,"quality_avg":6,"avg_extra_tool_calls":0.6,"runner_failures":0,"anti_hardcoding_violations":0,"effectiveness_penalty":0},"status":"keep","description":"Compact the agent-mode respond_to_user guidance.","timestamp":1777665858697,"segment":0,"confidence":3.307991513437058,"asi":{"hypothesis":"The respond_to_user section contains channel/image details that are not needed on every agent-mode turn; a shorter instruction can preserve direct user messaging behavior while reducing system prompt tokens.","learned":"Shortening RESPONDING TO USER reduced the assembled prompt by 55 tokens / 306 chars and the live e2e score improved to 0.694, clearing the effectiveness floor. This is a low-risk compression candidate, though the large e2e improvement may include live-model variance; consider a confirmation rerun or continue with similarly small prompt-section compactions.","next_action_hint":"Next try compacting another isolated low-risk section such as COMPLETION SIGNAL, or rerun the kept candidate unchanged if confidence/noise remains uncertain."}}
{"run":4,"commit":"61f6fef","metric":2392,"metrics":{"system_prompt_tokens_max":2392,"system_prompt_chars_max":11460,"constraint_preserving_retry_e2e_score":0.656,"pass_rate":0.4,"quality_avg":5.2,"avg_extra_tool_calls":0.4,"runner_failures":0,"anti_hardcoding_violations":0,"effectiveness_penalty":0},"status":"keep","description":"Compact the respond_to_user plus mark_work_complete completion-signal guidance.","timestamp":1777666019124,"segment":0,"confidence":2,"asi":{"hypothesis":"The common completion-signal branch can be shorter while preserving the essential ordering: final answer via respond_to_user first, then mark_work_complete only when fully complete, with no duplicate recap.","learned":"Prompt size improved from 2417 to 2392 tokens (-25) and effectiveness stayed above the 0.65 floor at 0.656 with zero penalty. This is a small but clean compression on top of the prior respond_to_user simplification.","next_action_hint":"Continue with small isolated prompt-section compactions. Candidate next sections: skills guidance (preserve registry-refresh behavior), status/continuation wording (higher risk), or execute_command file-reading duplication (larger token upside but more behavioral risk)."}}
{"run":5,"commit":"f246432","metric":2359,"metrics":{"system_prompt_tokens_max":2359,"system_prompt_chars_max":11269,"constraint_preserving_retry_e2e_score":0.678,"pass_rate":0.4,"quality_avg":5.6,"avg_extra_tool_calls":0.2,"runner_failures":0,"anti_hardcoding_violations":0,"effectiveness_penalty":0},"status":"keep","description":"Compact skills guidance while preserving registry-refresh behavior.","timestamp":1777666241173,"segment":0,"confidence":162.29310344827587,"asi":{"hypothesis":"The skills section can be shortened without losing the important behavior: load each skill at most once, reuse successful loads, diagnose on-disk-but-unloadable skills as runtime registry/refresh problems before recreating files, and avoid guessing skill contents.","learned":"Prompt size improved from 2392 to 2359 tokens (-33) and live effectiveness remained above the floor at 0.678 with lower extra tool calls. The concise skills wording preserved the registry-refresh behavior well enough for the replay while reducing prompt size.","next_action_hint":"Continue small isolated compactions. Best candidates: trim duplicated execute_command/file-reading guidance for larger token savings, or compress STATUS & CONTINUATION carefully because it is behavior-critical but verbose."}}
{"run":6,"commit":"f16da5d","metric":2139,"metrics":{"system_prompt_tokens_max":2139,"system_prompt_chars_max":10453,"constraint_preserving_retry_e2e_score":0.656,"pass_rate":0.4,"quality_avg":5.2,"avg_extra_tool_calls":0.4,"runner_failures":0,"anti_hardcoding_violations":0,"effectiveness_penalty":0},"status":"keep","description":"Compact execute_command shell and file-operation guidance.","timestamp":1777666437016,"segment":0,"confidence":61.948553054662376,"asi":{"hypothesis":"The execute_command section duplicates base shell/file-reading guidance and can be substantially shortened while preserving the critical behaviors: infer package manager from lockfiles, prefer read-only probes for status/context, avoid unrequested install/test/build/lint/typecheck, and read large files in ranges.","learned":"This large isolated compression reduced prompt size from 2359 to 2139 tokens (-220) while keeping e2e effectiveness above the 0.65 floor at 0.656. The replay still passed at 0.40 pass_rate with moderate tool count, so the removed command examples/list/create/write boilerplate were not necessary for this behavior target.","next_action_hint":"Consider a confirmation rerun because this is a larger prompt deletion, then try smaller status/continuation or base tool/file-reading compactions if stable."}}
{"run":7,"commit":"f16da5d","metric":12356,"metrics":{"system_prompt_tokens_max":1956,"system_prompt_chars_max":9710,"constraint_preserving_retry_e2e_score":0.442,"pass_rate":0.2,"quality_avg":5,"avg_extra_tool_calls":0.8,"runner_failures":0,"anti_hardcoding_violations":0,"effectiveness_penalty":10400},"status":"discard","description":"Compact base shell-command and file-reading guidance.","timestamp":1777666576676,"segment":0,"confidence":34.65107913669065,"asi":{"hypothesis":"The base shell/file-reading sections duplicate the now-compact execute_command agent-mode guidance and can be shortened while preserving lockfile package-manager inference, read-only probes, and ranged large-file reads.","learned":"This achieved a large token reduction from 2139 to 1956 tokens (-183), but live e2e effectiveness dropped to 0.442, reintroducing a large floor penalty. The base shell/file-reading detail appears to help this replay or the run exposed significant live variance; either way the broad base compression is not safe to keep.","rollback_reason":"Primary metric worsened from current best 2139 to 12356 because effectiveness fell below the 0.65 floor despite fewer tokens.","next_action_hint":"Avoid broad base shell/file compression for now. Prefer smaller isolated edits in agent-mode-only prose, or if revisiting base shell guidance, remove only one redundant sentence at a time and preserve concrete examples."}}
{"run":8,"commit":"a7e6f0a","metric":2134,"metrics":{"system_prompt_tokens_max":2134,"system_prompt_chars_max":10425,"constraint_preserving_retry_e2e_score":0.652,"pass_rate":0.4,"quality_avg":5.2,"avg_extra_tool_calls":0.8,"runner_failures":0,"anti_hardcoding_violations":0,"effectiveness_penalty":0},"status":"keep","description":"Shorten the injected current-time system prompt line.","timestamp":1777666743907,"segment":0,"confidence":35.96268656716418,"asi":{"hypothesis":"The injected local-time line can be shorter while still preserving enough date/time and timezone information for relative-date reasoning.","learned":"Formatting local time as a compact timestamp reduced the max system prompt from 2139 to 2134 tokens and kept e2e just above the 0.65 floor at 0.652. This is a tiny but clean prompt-size win; the e2e margin is narrow, so avoid stacking risky behavior-critical deletions without monitoring the floor.","next_action_hint":"Next try another small isolated non-policy compression, or rerun/confirm if future candidates hover near the effectiveness floor."}}
{"run":9,"commit":"3c65ce6","metric":2104,"metrics":{"system_prompt_tokens_max":2104,"system_prompt_chars_max":10187,"constraint_preserving_retry_e2e_score":0.73,"pass_rate":0.4,"quality_avg":6.6,"avg_extra_tool_calls":0,"runner_failures":0,"anti_hardcoding_violations":0,"effectiveness_penalty":0},"status":"keep","description":"List DotAgents runtime tools by name only in the system prompt.","timestamp":1777666879215,"segment":0,"confidence":37.47286821705426,"asi":{"hypothesis":"Runtime tool descriptions are redundant with native tool schemas and the dedicated agent-mode instructions for key tools, so the system prompt can list runtime tool names only for discoverability.","learned":"Omitting runtime-tool descriptions reduced prompt size from 2134 to 2104 tokens (-30) and the live replay scored 0.730 with zero extra tool calls. This suggests the description text in the prompt list was not necessary for the constraint-retry workload; native schemas plus agent-mode prose were sufficient.","next_action_hint":"Continue with similarly low-risk prompt-list/header compression, or cautiously try compressing STATUS & CONTINUATION now that the e2e score has margin above the floor."}}
{"run":10,"commit":"cc0896c","metric":1800,"metrics":{"system_prompt_tokens_max":1800,"system_prompt_chars_max":8700,"constraint_preserving_retry_e2e_score":0.904,"pass_rate":0.6,"quality_avg":6.2,"avg_extra_tool_calls":0.6,"runner_failures":0,"anti_hardcoding_violations":0,"effectiveness_penalty":0},"status":"keep","description":"Compact duplicated agent-mode local memory and config guidance.","timestamp":1777667044903,"segment":0,"confidence":38.87719298245614,"asi":{"hypothesis":"The agent-mode knowledge notes, past conversations, DotAgents config, and config-admin skill sections duplicate detailed base-prompt guidance, so they can be collapsed into a concise local-memory/config reminder without losing replay behavior.","learned":"Large prompt reduction from 2104 to 1800 tokens (-304) with live e2e improving to 0.904. The detailed duplicated agent-mode local-memory/config prose was not necessary for this workload when base guidance remains intact; the concise reminder preserved resume-prior-work and config-layer semantics well enough.","next_action_hint":"This is a high-impact keep. Continue with careful compression of other duplicated base/agent-mode sections, but avoid changing fixture/scoring. Candidate: cautiously compress STATUS & CONTINUATION or base tool/autonomy wording now that there is effectiveness margin."}}
{"run":11,"commit":"cc0896c","metric":12952,"metrics":{"system_prompt_tokens_max":1752,"system_prompt_chars_max":8394,"constraint_preserving_retry_e2e_score":0.426,"pass_rate":0.2,"quality_avg":4.6,"avg_extra_tool_calls":0.4,"runner_failures":0,"anti_hardcoding_violations":0,"effectiveness_penalty":11200},"status":"discard","description":"Compact status and continuation-turn guidance into three concise bullets.","timestamp":1777667184822,"segment":0,"confidence":34.625,"asi":{"hypothesis":"The status/continuation section is behavior-critical but verbose; compressing it to three concise bullets should preserve evidence-first status answers, one-probe limit, approval-boundary preservation, and safe next actions while reducing prompt tokens.","learned":"Tokens dropped from 1800 to 1752 (-48), but live effectiveness collapsed to 0.426 and triggered a large floor penalty. The fuller status wording appears important for this workload, or at least this compression destabilized it; preserving the original expanded status section is safer than compacting it aggressively.","rollback_reason":"Primary metric worsened from current best 1800 to 12952 because effectiveness fell below the 0.65 floor despite lower token count.","next_action_hint":"Do not aggressively compress STATUS & CONTINUATION. If revisiting, change only one sentence at a time or leave this behavior-critical section intact and seek savings in non-policy prompt lists/headers."}}
{"run":12,"commit":"63647ae","metric":1794,"metrics":{"system_prompt_tokens_max":1794,"system_prompt_chars_max":8672,"constraint_preserving_retry_e2e_score":0.946,"pass_rate":0.6,"quality_avg":7,"avg_extra_tool_calls":0.4,"runner_failures":0,"anti_hardcoding_violations":0,"effectiveness_penalty":0},"status":"keep","description":"Render DotAgents runtime tool names as a compact inline list.","timestamp":1777667333008,"segment":0,"confidence":23.560802833530108,"asi":{"hypothesis":"After removing runtime tool descriptions, the remaining bullet list/header can be compressed to a single inline list because native tool schemas and agent-mode instructions carry the actual semantics.","learned":"Inline runtime tool names reduced prompt size from 1800 to 1794 tokens and the live e2e score remained strong at 0.946. This is a tiny low-risk formatting win with no observed behavior loss.","next_action_hint":"Continue with low-risk formatting/header compactions. Avoid aggressive STATUS & CONTINUATION compression; consider one-sentence edits or small list/header changes only."}}
{"run":13,"commit":"63647ae","metric":24891,"metrics":{"system_prompt_tokens_max":1791,"system_prompt_chars_max":8648,"constraint_preserving_retry_e2e_score":0.188,"pass_rate":0,"quality_avg":4,"avg_extra_tool_calls":1.2,"runner_failures":0,"anti_hardcoding_violations":0,"effectiveness_penalty":23100},"status":"discard","description":"Shorten the base tone instruction wording.","timestamp":1777667482934,"segment":0,"confidence":16.85472972972973,"asi":{"hypothesis":"The base tone line can be compressed without changing behavior: concise responses, no pre/postamble, and 1-3 sentence preference should be preserved with fewer tokens.","learned":"The edit saved only 3 tokens but the live replay collapsed to 0.188 with zero passing cases, creating a large effectiveness penalty. This is likely live-model variance or surprising sensitivity to tone wording, but the token win is too small to justify risk.","rollback_reason":"Primary metric worsened from current best 1794 to 24891 because effectiveness fell far below the 0.65 floor.","next_action_hint":"Do not spend more iterations on tiny base tone/autonomy wording edits. Prefer larger low-risk structural savings, or confirm current best stability with a no-code rerun before making more behavior-adjacent edits."}}
{"run":14,"commit":"63647ae","metric":21876,"metrics":{"system_prompt_tokens_max":1676,"system_prompt_chars_max":8146,"constraint_preserving_retry_e2e_score":0.246,"pass_rate":0,"quality_avg":5,"avg_extra_tool_calls":0.4,"runner_failures":0,"anti_hardcoding_violations":0,"effectiveness_penalty":20200},"status":"discard","description":"Remove the compact agent-mode local memory and config reminder entirely.","timestamp":1777667623108,"segment":0,"confidence":16.424691358024692,"asi":{"hypothesis":"The compact agent-mode local memory/config reminder may be fully redundant with the detailed base prompt guidance, so removing it should save tokens without changing the constraint-retry behavior.","learned":"Removing the section saved 118 tokens but live effectiveness collapsed to 0.246 with no passing cases. The concise agent-mode reminder appears to provide important local emphasis despite base guidance, or removal destabilized state reconstruction. Keep the compact reminder rather than deleting it.","rollback_reason":"Primary metric worsened from current best 1794 to 21876 because the e2e score fell far below the 0.65 effectiveness floor.","next_action_hint":"Do not remove the local-memory/config reminder entirely. If optimizing it further, trim one phrase at a time while preserving all three concepts: durable notes, prior conversations/resume, and layered config/config-admin."}}
{"run":15,"commit":"63647ae","metric":21879,"metrics":{"system_prompt_tokens_max":1779,"system_prompt_chars_max":8579,"constraint_preserving_retry_e2e_score":0.248,"pass_rate":0,"quality_avg":5,"avg_extra_tool_calls":0.2,"runner_failures":0,"anti_hardcoding_violations":0,"effectiveness_penalty":20100},"status":"discard","description":"Trim the compact agent-mode local memory and config reminder wording.","timestamp":1777667773206,"segment":0,"confidence":16.01605136436597,"asi":{"hypothesis":"The compact local memory/config reminder can be made slightly shorter while preserving all three concepts: durable notes, prior conversations/resume recovery, and layered DotAgents config with config-admin for unfamiliar edits.","learned":"The edit saved 15 tokens but live effectiveness collapsed to 0.248 with no passing cases. Even phrase-level changes to this reminder appear risky under the current replay/noise, despite preserving the apparent semantics.","rollback_reason":"Primary metric worsened from current best 1794 to 21879 because e2e score fell far below the 0.65 floor.","next_action_hint":"Do not further trim LOCAL MEMORY & CONFIG in this session. Keep the exact compact reminder from cc0896ca/63647ae and seek savings in unrelated formatting or run a no-code confirmation to quantify noise."}}
{"run":16,"commit":"63647ae","metric":23382,"metrics":{"system_prompt_tokens_max":1782,"system_prompt_chars_max":8557,"constraint_preserving_retry_e2e_score":0.218,"pass_rate":0,"quality_avg":4.4,"avg_extra_tool_calls":0.2,"runner_failures":0,"anti_hardcoding_violations":0,"effectiveness_penalty":21600},"status":"discard","description":"Omit the runtime tool names list in agent-mode prompts.","timestamp":1777667913647,"segment":0,"confidence":1.8904888215233042,"asi":{"hypothesis":"In agent mode, native function schemas plus dedicated tool-use sections should make the inline DotAgents runtime tool names list redundant, so omitting that list should save tokens without reducing behavior.","learned":"Removing the tiny runtime tool names list saved 12 tokens but e2e collapsed to 0.218 with no passing cases. The explicit inline availability cue appears important or the live benchmark is very sensitive; keeping the compact inline list is safer than removing it.","rollback_reason":"Primary metric worsened from current best 1794 to 23382 because the e2e score fell far below the 0.65 floor.","next_action_hint":"Do not remove the runtime tools list entirely. Keep the compact inline list; seek savings in sections not serving as availability cues, or consider confirmation reruns to estimate noise before further tiny edits."}}
{"run":17,"commit":"63647ae","metric":23667,"metrics":{"system_prompt_tokens_max":1767,"system_prompt_chars_max":8527,"constraint_preserving_retry_e2e_score":0.212,"pass_rate":0,"quality_avg":4.4,"avg_extra_tool_calls":0.8,"runner_failures":0,"anti_hardcoding_violations":0,"effectiveness_penalty":21900},"status":"discard","description":"Combine the first base tool-usage bullets into one schema/tool-name instruction.","timestamp":1777668098281,"segment":0,"confidence":1.0352770284291346,"asi":{"hypothesis":"The first three TOOL USAGE bullets are semantically overlapping and can be combined into one concise instruction about native function calls, exact schemas, required parameters, and exact tool names.","learned":"The edit saved 27 tokens, but e2e collapsed to 0.212 with no passing cases. Even semantically equivalent compression in the base TOOL USAGE section is risky under this live replay; the explicit separate bullets may anchor tool behavior better, or the benchmark variance is severe.","rollback_reason":"Primary metric worsened from current best 1794 to 23667 because e2e fell far below the 0.65 floor.","next_action_hint":"Avoid compressing base TOOL USAGE in this session. Focus on non-policy formatting only, or do a no-code champion rerun to understand whether recent collapses are benchmark noise before attempting more prompt-policy edits."}}
